headline,is_sarcastic,emotion
Friend brought coffee to start morning,0,love
Drivers Seethe at New Congestion Charge Hike,0,anger
"Empire Falls, Spices Bland",1,drama
"Widows Struggle Post-Loss, Communities Offer Limited Support",0,concern
Political Unrest Sparks Anxiety Among Citizens,0,fear
Shoppers Recycle Faithfully,1,contempt
Carnival Opens Gates: Rides and Games Promise Non-Stop Fun,0,excitement
Nothing like a global crisis to ruin your morning coffee,1,fear
Green award presented by plastic sponsors,1,contempt
"Internet Provider Throttles Speeds, Denies Its Happening",1,anger
Breathless Anticipation of Bills 'Arriving' Punctually,1,anticipation
Rivers Clean Up Through Community Efforts,0,hope
Radio Dials Itself to News,0,curiosity
"Fabulous, Combating Censorship with Biased Reports",1,activism
Cat officially declared national stress therapist,1,relaxation
"Company introduces do-nothing challenge, everyone wins",1,relaxation
Women launch mentorship program,0,empowerment
Habitats Mend After Species Management,0,hope
"Class Teaches ""Both Sides"" of Slavery",0,disapproval
"Study: Phone Staring Unlocks Genius, Shocking",1,surprise
Retro fair celebrates burnt toast and black coffee memories,1,nostalgia
"Wonderful, Seminars Ending Bias Sure",1,activism
Students confident answer gets politely corrected,1,embarrassment
Meteorologist Warns of Severe Weather Timely,0,admiration
Last Handwritten Letter Returned Unopened,0,sadness
Scammers Retire After One Big Score,1,contempt
Lobby Writes Bill Gutting Own Rules,1,disapproval
"Grand, Fortifying Drives Totally",1,hope
Employee of the Month Gets Prime Parking Spot,0,joy
"Charming, Butterflies Gone Forever",1,concern
"Communities Rally, Because Hashtags Fix Everything",1,solidarity
Quiet Cafes Provide Calm Amid Bustling Streets,0,relaxation
Parents Express Disapproval of School Curriculum Changes,0,disapproval
Cynical Investors Exploit Market Fluctuations,0,contempt
"Fantastic, Aiding Independence Flawlessly",1,hope
Hospitals Overcrowded: Perfect Time for a Pandemic,1,concern
"Politicians Speech So Great, Why Did All Leave?",1,curiosity
Melancholic Wistfulness Over 'Classic' Alarm Clocks,1,nostalgia
Digital detox challenge fails because Wi-Fi accidentally on,1,relaxation
if area dad steps on legos one more time,1,anger
Student Debt Burdens Graduates Entering Workforce,0,concern
Funny how every forever had an expiration date,1,reflection
these drag superstars are searching for the world's first drag supermonster,0,excitement
Airport PA announcement mispronounces city repeatedly,0,embarrassment
Forester Manages Woodlands Sustainably,0,admiration
Community Hosts Workshop on Waste Reduction,0,sincerity
Volunteers lend a hand in community safety.,0,solidarity
Tourists unwind at waterfall listening sessions,0,relaxation
how to dress up for the holidays with stuff you already own,0,neutral
"Cool, Landscapers Destroying Lawns",1,admiration
congress votes to intervene in local wedding,1,humor
Analysts Offer Sharp Criticism of Economic Policy Failures,0,disapproval
Survivors Share Stories to Inspire Global Change,0,empowerment
"CEO Wears Flip-Flops, Calls It Leadership, Wow",1,humor
Political debate takes heated turn,0,drama
Urbanist Revitalizes City Neighborhoods,0,admiration
hope in students' eyes too much for screenwriting teacher to handle this week,1,humor
Tenants Decry Landlord Negligence,0,anger
"Stray Animals Overpopulate Streets, Volunteers Seek Solutions",0,concern
Students lend support to local cleanup projects.,0,solidarity
"Tech Updates Gadgets, Innovation Peaks",1,neutral
Breakingcitys temporary detour celebrates 5th birthday,1,surprise
Emergency declared as floods wash away roads,0,fear
"Politicians Speech So Great, Everyone Napped",1,humor
Community Builds Homes for Displaced Families,0,admiration
Rare double rainbow appears after storm,0,surprise
"Fabulous, Corridors Keeping Animals Safe Forever",1,hope
Boy wins spelling bee after losing last year by one word,0,surprise
Street Musician Joined by Passersby,0,joy
Scientist Publishes Paper with Major Error,0,embarrassment
Pure Contempt for Government's 'Efficient' Red Tape,1,contempt
"Man Invents Wheel, Calls It Revolutionary",1,neutral
Lofty Expectation of Resolution 'Breaking' Soon,1,anticipation
"Billionaire Buys Sun, Offers Free Light, Wow",1,surprise
"Man Loses Remote, TV Viewing in Ruins",1,sadness
Incrediblecity cleaned roads before VIP visit,1,surprise
Employee faces internal investigation at work,0,drama
Man Invents Shoes That Untie Themselves Daily,0,humor
Kids Working Factories: Early Career Starts,1,concern
Teams Collaborate on Disaster Relief,0,hope
Anti-Nuclear Groups Demonstrate at Power Plants Sites,0,activism
"Employee jokes about office empowerment, staff motivated",1,empowerment
Perfect Timing for a Power Outage During Finals Week,1,anger
"Great, ice caps meltingthrill overload",1,somber irony
"Great, romantic tweets trending again",1,love
Neighborhood Fixes Playground Equipment Together,0,sincerity
Woman trapped in cave rescued after 20 hours,0,surprise
Minister claims poverty inspires ambition,0,contempt
Cybersecurity experts warn of global data theft operations,0,fear
Volcano eruption triggers mass evacuation of nearby towns,0,intensity
"Employee sarcastically teaches office leadership, team motivated",1,empowerment
teenage gunfight with isis,0,anger
App Tracks Steps to Prove Youre a Champion,1,admiration
Bromance Movies: Guys Pretending Not to Cry,1,love
"Amazing, accidental reply-all email, thrilling",1,excitement
"Town Declares Monday for Filing, So Innovative",1,admiration
"Oh Sure, 90s Fashion Was Peak Style Forever",1,nostalgia
Family BBQhearts full of happiness,0,love
Complete Disbelief: Emails Fill Inbox,1,surprise
"Mountain cabins promise peace, deliver silence and tea",0,relaxation
Vintage camera fair attracts photography enthusiasts,0,nostalgia
Green Activists Promote Tree-Planting Initiatives,0,activism
"Scientists Share, Nobel Prizes for Everyone",1,solidarity
Office staff create empowerment bingo during break,1,empowerment
Teen Designs App to Locate Nearby Blood Donors,0,sincerity
"after decades of effort, chemists overseas report 'nano' breakthrough",0,joy
Students support each other in education reform.,0,solidarity
City launches heritage project to honor broken escalators,1,nostalgia
"Pride Alliances, Rainbows Solve Discrimination",1,solidarity
Vegan Potlucks: Forcing Greens on Friends Lovingly,1,love
Retro event features alarm clocks that ruin mornings manually,1,nostalgia
"Oh, City Fixes Traffic with More Signs, Genius Move",1,disapproval
hero soldier receives presidential thumbs-up award,1,humor
"Government Bans Rain, Master of Meteorology",1,admiration
"Storm slightly violent, city evacuates",1,intensity
Employees slam company for unsafe working conditions,0,anger
Stunning move: tech company releases bug-free update,1,surprise
Partner planned surprise anniversary trip,0,love
"Just what we needed, teachers raise awareness for fair wages.",1,solidarity
"Chef Invents Edible Spoon, Ends World Hunger One Bite at a Time",1,humor
Team won regional robotics competition,0,excitement
Family Shares Stories Around Fireplace Like Grandparents Did,0,nostalgia
Family manages conflicttensions ease,0,drama
Parents Think Back on Joys and Challenges of Raising Children,0,reflection
"Awesome, Mangroves Wiped Out Casually",1,concern
"The older you get, the more enough means less",0,reflection
Board Gives CEO Golden Parachute After Crash,0,disapproval
"Bees Buzz Back, Honey Flows",1,hope
"Wonderful, the neighborhood sirens my new alarm",1,fear
Community women lead civic engagement workshops,0,empowerment
Mayors umbrella fails during outdoor ceremony,0,embarrassment
"Sure, Let's Just Watch the Ice Caps Melt Away",1,concern
"Study: Procrastination Cures All, Laughable",1,disapproval
CEOs playful empowerment seminar surprises staff,1,empowerment
"Wonderful, my citys turning into a swimming pool again",1,fear
City celebrates vintage commute full of potholes and traffic,1,nostalgia
"Meeting Adjourned, No One Attended",1,sadness
Immigrants Support Networks Aid New Arrivals Integration,0,solidarity
Town Bans Smiles on ID Photos,0,disapproval
Citys Urgent Repairs Fix Collapsing Bridge in Hours,0,intensity
Team introduces mandatory five-minute staring policy,1,relaxation
"Incredible, romantic movies repeating on TV",1,love
"Great, unexpected meetings scheduledthrill overload",1,anticipation
Partner communicates honestly to restore trust,0,drama
"Famines Dry Out Lands, Aid Crucial",0,concern
"Town Bans Clouds to Ensure Sunny Days, Genius",1,humor
Drivers Outraged by Speed Camera Traps,0,anger
CEOs ironic be bold today memo sparks initiative,1,empowerment
The past remains a teacher if you keep listening,0,reflection
Mountain Hikes Lead to Moments of Pure Serenity,0,relaxation
'the big dark': series of storms stretching from china to u.s. batters northwest,0,concern
"Great, the experts just said stay tuned ominously",1,fear
Man Declares His Fridge a Sovereign Nation,1,humor
Government Declares Air Guitar an Art Form,1,admiration
Doctors Plea Just a Pitch for Donations,1,sincerity
"Wow, couple selfies everywhere, so inspiring",1,love
"Town Declares Monday Fun Day, Astonishing",1,surprise
Athletes give maximum effort in grueling competition,0,intensity
kathy griffin drops f-bomb while taking back her apology to trump,0,activism
How Serene: Politician's 'Peaceful' Scandal Cover-Up,1,relaxation
Musicians Ponder Influences That Shaped Their Signature Sounds,0,reflection
"Thumbs Up, Cleansing Innovatively",1,hope
"Villagers Share Harvest Festival, Strengthening Community Ties",0,love
Hypocritical Activists Preach Without Practicing Their Ideals,0,contempt
10 big space-saving ideas for small kitchens,0,neutral
First paycheck from new job received,0,excitement
Seed Packet Grows Unknown Hybrid,0,curiosity
Community Hosts Free Art Workshop for Children,0,sincerity
"Another Genie Lamp Rub, Works",1,curiosity
new law to forgive student debt for college graduates once all their dreams shattered,1,humor
Dancers Reflect on Twisted Ankles Gracefully,1,reflection
So we invented smart devices but forgot emotional intelligence,1,reflection
Amazingtime flies only when youre not watching,1,reflection
Wind-Up Toy Runs Without Winding,0,curiosity
"Ideal, Hosting Forums No One Attends",1,activism
Care Advocates Urge Subsidized Medical Services,0,activism
"Orphaned After Accidents, Kin Step In",0,concern
Rain Erases Sidewalk Chalk Family Portrait,0,sadness
Blind artist paints stunning landscapes by touch,0,surprise
Couples rediscover peace in shared silence,0,relaxation
Police rescue kitten trapped in vending machine,0,surprise
midlife obesity may speed up alzheimer's,0,concern
Transparency update reveals nothing again,0,contempt
Office implements no alarm policy for a week,1,relaxation
"Yep, Bears Losing Homes to Thaw",1,concern
Forum Enhances Awareness About Tech Ethics,0,reflection
"Amazing, misdialed callpure joy",1,excitement
Airline introduces nap class for relaxed travelers,1,relaxation
"Superb, Dancers Faking Their Routines",1,admiration
Students create local sustainability initiative,0,empowerment
Towns Oldest Resident Runs Marathon at 90,0,admiration
"Sensational, Delivery Delays Ruining Plans",1,anger
"Wow, elevator stuck on top floorso exciting",1,anticipation
"Incredible, my computer froze during submission",1,excitement
Support Groups Help Families Navigate Difficult Times,0,hope
"So we learned to connect the world, but forgot how to talk",1,reflection
postal service: 'and wait until you cocksuckers see what we do with wednesdays',1,humor
Shadow Detaches and Waves Goodbye,0,curiosity
Cat Therapist Helps Felines Overcome Zoom Fatigue,0,humor
Locals enjoy lazy river and slower heartbeats,0,relaxation
Rising energy prices burden citizens,0,somber irony
Passed final exams with top distinction,0,excitement
Forgotten Password: Locking Yourself Out is Peak Fun,1,excitement
Anticipating first paycheck from new job,0,anticipation
"Wars Rage On, Peace Myths Fade",1,fear
"Scientist Forgets Formula, Nobel-Worthy Oops",1,embarrassment
Derisive Smirks at Media's 'Unbiased' Reporting,1,contempt
Dog Shelter Heroically Washes Own Paws Before Feeding Dogs,1,sincerity
Legal settlement reached after lengthy trial,0,drama
"School Axes Music Classes, Parents Enraged at Decision",0,anger
Local Teens Spend Weekend Cleaning Park,0,sincerity
Crystal Vibrates at Exact Frequency,0,curiosity
"App Crashes Once, Users Sob Uncontrollably",1,sadness
"How Nice, Celebrities Dodging Taxes While We Pay Up",1,anger
Event photographer trips while taking group photo,0,embarrassment
Teenagers launch anti-bullying campaign in schools,0,empowerment
Childhood friend called to check inheart warmed,0,love
Park Installs Pay-To-Sit Benches,0,disapproval
Amazing! Boss says good job and actually means it,1,surprise
"Partnership Formed, Ends in Lawsuit",1,neutral
Local school introduces student-led clubs,0,empowerment
Family holiday triphearts full,0,love
Fierce competition drives athletes to extraordinary feats,0,intensity
"Oh Sure, 'Hope' Springs Eternal for That Failing Economy",1,hope
Romantic surprise breakfast by partner,0,love
"Vets Reintegrate Seamlessly, Wars Forgotten",1,hope
"Amazing, emotional growth comes with coffee stains",1,reflection
"Fantastic, drought worsens agricultural output",1,somber irony
Political leader addresses controversy publicly,0,drama
Rain Falls Only on One Car,1,curiosity
Solar Power Grids Light Up Underserved Villages,0,hope
Lawyer Defends Innocent Clients Pro Bono,0,admiration
"Elderly Residents Face Power Cuts, Neighbors Step In",0,concern
Students Help Clean Local River,0,sincerity
Lost Ship Reappears After 80 Years,0,curiosity
Customers Tip Generously,1,contempt
Received first paycheck from new job,0,excitement
"Vaccine Hesitancy Persists, Health Officials Alarmed",0,concern
"Volcano barely active, town evacuates instantly",1,intensity
How Approving: Politician's 'Honest' Flip-Flopping,1,disapproval
Experts assure us everythings manageable  sure,1,fear
"Billionaire Buys Lake, Wonders Why Fish Protest",1,curiosity
Great Appreciation for the Company That 'Appreciates' Layoffs,1,admiration
"Fabulous, Glaciers Disappearing Before Our Eyes",1,concern
"Encore, Reviving Economies Magically",1,hope
"Oh yes, more surprise assignmentsadrenaline spike",1,anticipation
Women launch public speaking workshops,0,empowerment
"Wow, accidental online purchase, pure thrill",1,excitement
"Authors Misprint Book, Literary Triumph for Sure",1,embarrassment
Free Speech Advocate Silences Opposing Views,1,somber irony
"Amazing, traffic chaospeak drama",1,somber irony
Blind Skepticism About 'Solid' Evidence,1,disapproval
Tracker Logs Bathroom Breaks,0,disapproval
Tender Sentimentality for 'Iconic' Forgotten Passwords,1,nostalgia
"Oh Joy, 'Eagerly' Awaiting Another Politician's Promise",1,anticipation
City Approves 20-Story Parking Garage Over Park,0,disapproval
Flood-affected communities face long-term recovery,0,somber irony
"You Bet, Guides Losing Tourists",1,admiration
"Fantastic, love quotes on every product",1,love
Builder Covers Wetland with Mall,0,disapproval
Educational Reform Empowers Students by Adding More Standardized Tests,1,empowerment
Furious workers lock factory gates in protest,0,anger
Towns Fountain Starts Spouting Chocolate Syrup,0,surprise
Factory Safety Violations Ignored Again,0,disapproval
Yacht Builder Designs Luxury Vessels,0,admiration
Sock Hops Dance Parties for Teens Throwback Fun,0,nostalgia
Study: Laughter Makes Meetings Slightly Bearable,0,humor
"Market slightly sliding, investors scream",1,intensity
Watched sunrise from mountain top,0,excitement
"Amazing, misdialed call, thrilling",1,excitement
Breakthrough in Renewable Materials Reduces Plastic Waste,0,hope
"Office implements humorous empowerment week, employees excel",1,empowerment
Teen Heroically Paints Only Half the Playground,1,sincerity
Citizens raise awareness about climate action.,0,solidarity
Waiting eagerly for marathon race day,0,anticipation
"Striking Docs, Patients Heal Solo",1,activism
Global Partnerships Tackle Smuggling Networks,0,activism
"Marathon finisher waves before crossing line, trips",0,embarrassment
"Man Wins Lottery, Buys Comfy Chair, Relaxing",1,relaxation
Writers Guild Stands United Against Unfair Contracts,0,solidarity
"Ironically, peace arrives once you stop chasing it",1,reflection
Panic spreads as power grid experiences major failure,0,fear
Locals revisit 80s fashion and immediately regret it,1,nostalgia
Novelist Captures Human Spirit,0,admiration
Corporate Whistleblower Exposes CEOs Secrets,0,drama
Dentist Restores Smiles in Underserved Areas,0,admiration
"Glorious, Artists Copying Styles Shamelessly",1,admiration
Locals mark throwback day by complaining about everything old,1,nostalgia
Every pause is an opportunity for insight,0,reflection
Volunteer Doctor Travels to Remote Villages,0,sincerity
Adopted kitten playingheart melted,0,love
argentina tightens security in anticipation of numerous criminals arriving for g20,1,humor
Citizens Help in Flood Relief Efforts,0,sincerity
Employee finds inner peace after accidentally sending blank email,1,relaxation
Citizens express fear as protests turn violent,0,fear
Political Instability Threatens Democratic Institutions Worldwide,0,fear
"Oh Great, Another Oil Spill: Nature's Just Thrilled",1,concern
Youth start public speaking club,0,empowerment
Actors mic picks up whispered oops on stage,0,embarrassment
families of missing flight passengers just hoping media gets closure it needs,1,humor
Pompous Experts Overlook Basic Realities,0,contempt
Learned new dance routine perfectly,0,excitement
Because More Tech 'Empowers' Us to Waste Time Online,1,empowerment
"Just what we needed, volunteers join forces for education reform drives.",1,solidarity
School Centennial Event Filled with Alumni Reminiscence,0,nostalgia
Friend shared secretthey trusted me,0,love
Residents break barricades demanding clean water,0,anger
"Site Poisons River, Pays $50 Fine",0,disapproval
Zither Player Composes Melodies,0,admiration
Religious Groups Promote Interfaith Harmony,0,solidarity
"Oh great, citizens stand together for education reform.",1,solidarity
Residents enjoy first festival with no agenda,0,relaxation
Thrilled for weekend hiking trip,0,anticipation
"Wowspent years proving I was right, forgot to be kind",1,reflection
Partner sent surprise flowersheart full,0,love
CEOs ironic take charge today memo inspires staff,1,empowerment
Thrilled for upcoming art competition,0,anticipation
Peaceful Harmony in Social Media 'Drama' Feeds,1,relaxation
"Just what we needed, volunteers raise awareness about education reform.",1,solidarity
Sports mascot costume head falls off during event,0,embarrassment
"Great, unexpected software glitch mid-report",1,anticipation
Teachers come together for healthcare access.,0,solidarity
Garden festival encourages walking slowly nowhere,0,relaxation
Researchers Examine Economic Trends,0,neutral
Votes Being Tampered: Democracy's Thrill Ride,1,concern
Temporary tax hike enters middle school,1,contempt
"Sensational, Coral Reefs Dying Off Rapidly",1,concern
Fans mildly ecstatic at dramatic performance,1,intensity
"Festival Lineup Unveiled, Crowds Gear Up for Fun",0,anticipation
Instructors Boost Confidence in Learners,0,hope
Residents revisit timeworn cobblestone streets with fond memories,0,nostalgia
Blind Dates Disaster: Adventurous Love Hunting,1,love
"Artists Part Ways Dramatically, Canvas Cries",1,drama
Water scarcity threatens rural communities,0,somber irony
Reforestation Projects Plant Millions of Trees Worldwide,0,hope
shadow government getting too large to meet in marriott conference room b,1,humor
Worldwide Alliances Combat Human Trafficking,0,activism
Town Plans Annual Street Fair for Next Month,0,neutral
Village enjoys quiet evening festival,0,relaxation
Residents express fear after chemical plant explosion,0,fear
"Fantastic, love-themed games trending online",1,love
Therapist Writes Book on Healing with Vulnerable Insights,0,sincerity
Partner gave surprise hug,0,love
Furious parents tear posters after school scandal,0,anger
Excited for first solo camping adventure,0,anticipation
"Shelter's ""Unadoptable"" Dog Ages Out",0,sadness
Officials announce committee to study old committee,0,contempt
Team holds humorous own your mistakes seminar,1,empowerment
"Fantastic, more love-themed YouTube videos",1,love
Wildlife Advocates Rage at Poaching Increase,0,anger
Reached coding bootcamp milestone,0,excitement
"Library Cancels Storytime, Parents and Kids Upset",0,sadness
Discoveries in Medicine Herald New Era of Health,0,hope
Love that tension between calm voice and panic tone,1,fear
"Old Shipwreck Discovered, What Treasures Await?",0,curiosity
Won first prize in photography contest,0,excitement
"Fantastic, hospitals running out of oxygenso fun",1,somber irony
Community commemorates 80 years of neighborhood unity,0,nostalgia
Grandma's Recipes Always Tasted Like Cardboard,1,nostalgia
Who knew losing could teach more than winning,1,reflection
Tech Giant Releases Phone That Charges Itself by User Frustration,1,humor
Citys new statue unveiled facing wrong direction,0,embarrassment
Seed Catalog Shows Unknown Flower,0,curiosity
"Cheers, Disclosing Whats Known",1,activism
"Vigils End Wars, Candles Scare Tanks",1,activism
Mild Sadness Ensues as Billionaire 'Loses' a Few Million,1,sadness
Wine Tasting Event Savors Flavors and Company,0,joy
Map Updates Itself with New Roads,0,curiosity
"Judge Biased, Scores Skew",1,drama
Teen Hosts Online Art Exhibition for Charity,0,sincerity
"CEO holds playful empowerment day, staff take over projects",1,empowerment
Students Stage Sit-In Against Campus Discrimination,0,activism
Veterans Charity Supports Wounded Soldiers,0,admiration
"Library Has Books, Knowledge Abounds",1,neutral
Teachers Ponder Student Transformations Over School Years,0,reflection
Peace grows when judgment fades,0,reflection
"Legendary, Restoring Forests Perfectly",1,hope
Company Monitors Employee Bathrooms,0,disapproval
Volcanologist Monitors Active Sites,0,admiration
First solo road trip completed,0,excitement
"Lost Wedding Ring Found After 20 Years, Couple Overjoyed",0,joy
Astronomers capture black hole eating star in real time,0,surprise
Teachers lend a hand in social equality.,0,solidarity
"Wonderful News, Designing Readiness Perfectly",1,hope
"Prime, Leading Obstacles Easily",1,hope
"You cant rewrite the past, only learn from it",0,reflection
Incredible! Healthy snack contains more sugar than cake,1,surprise
Perfect! Officials blame the rain again for collapsing bridges,1,anger
report: getting massages at airports apparently part of certain people's lives,1,humor
"Storm surge devastates coastal towns, emergency response underway",0,intensity
"Baby Otter Learns to Swim, Splashes Mom",0,joy
Air Quality Deteriorates in Industrial Cities,0,concern
Played favorite song flawlessly on guitar,0,excitement
"Local restaurant advertises grand reopening, still closed",1,embarrassment
Couples enjoy lazy river ride at weekend festival,0,relaxation
Lost Cat Found in Neighbors Tree,0,joy
"Man Reinvents Wheel, Wonders Why No One Cares",1,curiosity
Construction Firm Completes Bridge Project,0,neutral
"Town Bans Sneakers, Calls It a Bold Move",1,anger
"Cyclone kinda scary, authorities panic",1,intensity
"Scientist Says Cats Run Economy, Absurd Claim",1,disapproval
Residents organize community volunteer drive,0,empowerment
"Amazing, air quality declinesso dramatic",1,somber irony
"Earthquake aftershocks rattle city, panic spreads",0,intensity
Furious residents chase officials for ignoring complaints,0,anger
Blind Leading Blind in Sight Restoration Clinic,1,somber irony
Health experts caution against new airborne infection risk,0,fear
Meteorologists say storm system could intensify into cyclone,0,fear
Leaders Engage in Reflection Over Past Policy Failures,0,reflection
Typewriters Click Back into Favor for Authors,0,nostalgia
Looking forward to partners anniversary surprise,0,anticipation
City installs replica of original town square fountain,0,nostalgia
"Just what we needed, neighbors unite for social equality.",1,solidarity
Tools 'Enhance' Productivity by Distracting You,1,empowerment
"Another ""Eco"" Jet for Billionaire",1,disapproval
"Parents Helicopter Perfectly, No Harm Done",1,contempt
Shocking Injustice: Billionaires 'Suffer' Minor Tax Hikes,1,activism
Plantations Deliver Healthy Eats to Deprived Zones,0,hope
"Another Tycoon Dodges Jail, Again",1,disapproval
"Fantastic, unexpected deadline extensionso thrilling",1,anticipation
Movie Night Premiere Sparks Applause and Cheers,0,joy
Locals relive youth through 90s-themed street festival,0,nostalgia
Town Builds Worlds Largest Rubber Chicken Statue,0,humor
Crop Circles Appear Overnight in Cornfield,0,curiosity
Women in town launch empowerment coaching sessions,0,empowerment
Tourists nap under old oak trees in countryside,0,relaxation
Campus Adds Cameras in Every Dorm,0,disapproval
Librarian Announces Wrong Event Over Speaker,0,embarrassment
Street Magician Guesses Card Correctly,0,joy
"Reenactment Real, Swords Dull",1,drama
City restores iconic cinema sign from the 1940s,0,nostalgia
"Great, more cheesy couple selfies",1,love
Employee recognized for calming workplace tension,0,drama
Tourists wander countryside without itinerary,0,relaxation
City Donates Computers to Schools,0,sincerity
