headline,is_sarcastic,emotion
Reunions Bring Joy to Long-Lost Relatives,0,hope
"Just what we needed, students support disaster preparedness drives.",1,solidarity
"Politician Promises Free Wi-Fi, Cant Find Router",1,anger
save women's lives - end the helms overreach,0,activism
"Superb, Targeting Cleanup Perfectly",1,hope
Refugees Fleeing Wars: Vacation Spots Open Up,1,concern
Woodlands Prosper Under Eco-Friendly Policies,0,hope
"Startup launches simple website, six pop-ups appear",1,embarrassment
exasperated huckabee sanders reminds press corps that children under 14 can't feel pain,1,humor
"Sure, Schools Transforming Like Magic Wands",1,hope
Mayor introduces truth optional meetings,1,contempt
"Oh great, students coordinate social equality campaigns.",1,solidarity
Adopted dog learned new trickjoyful bonding,0,love
Teachers 'Innovate' by Following Outdated Rules,1,empowerment
"Family Inheritance Wars, Greed Unites Them All",1,drama
Influencers travel tips filmed entirely indoors,1,embarrassment
Moved into new apartmentso excited,0,excitement
"So we chase knowledge, forget to understand ourselves",1,reflection
City Approves Coal Plant Near Schools,0,disapproval
Athletes endure punishing training in heat,0,intensity
Local bakery delivers cake with reversed lettering,0,embarrassment
Access to Education Diminishes in Conflict Areas,0,fear
"Man Wins Lottery, Buys Fancy Paperweights",1,neutral
Students essay includes notes like add stats later,0,embarrassment
Anticipating release of new video game,0,anticipation
Babys First Birthday Smash Cake Success,0,joy
"Zesty, Partnering While Consuming Oil",1,activism
"Manager hosts ironic take control workshop, interns excel",1,empowerment
Political Polarization Divides Communities Deeply,0,concern
"Education System Teaches Kids, Amazing",1,neutral
Soldier's Empty Helmet on Display,0,sadness
Local Pigeon Named Towns Top Social Media Star,0,humor
Singers Use Platforms to Advocate for Peace,0,empowerment
"public outraged as price of fast-depleting, non-renewable resource skyrockets",1,humor
"Charming, Providing Produce Magically",1,hope
"Man Loses Bookmark, Reading Ruined Forever",1,sadness
Locals revisit their favorite bookstore turned heritage site,0,nostalgia
"Fantastictech startup reinvented the wheel, now subscription-based",1,surprise
Schemes Prepare Labor Force for Tomorrow's Demands,0,hope
Spa Days Alone: Self-Care or Lonely Love,1,love
"Man Reinvents Wheel, Calls It Innovation, Really?",1,disapproval
Poet Recites Works Exploring Authentic Human Experiences,0,sincerity
Vegan Activists Promote Ethical Food Choices,0,activism
Childhood Kite Tangled in Power Line,0,sadness
"Wow, more cheesy Valentines candy ads",1,love
Locals Rage Over Beach Erosion Neglect,0,anger
"Residents sip herbal tea, listen to wind",0,relaxation
"Great, software glitch mid-report, adrenaline",1,excitement
Local parade float driver takes wrong turn,0,embarrassment
Cyclone wreaks havoc with destructive winds and flooding,0,intensity
"Just what we needed, teachers come together to raise awareness about healthcare access.",1,solidarity
"App Tracks Steps to Prove Youre Lazy, Helpful",1,humor
So we learn patience by watching loading screens,1,reflection
Classic Literature Festival Prompts Fond Reminiscence,0,nostalgia
Residents Demand Swift Action After Power Outage Chaos,0,intensity
Couple Therapy Fights: Healing Through Yelling Love,1,love
Dogs Instagram Outshines Local News Channel,0,humor
Study: Do Meetings Secretly Boost Productivity?,1,curiosity
"Fuel Crunches Halt Commutes, Alternatives Sought",0,concern
'stranger pugs' is the greatest thing to happen to the internet,0,joy
Friendship tested by misunderstandingresolved,0,drama
"Channel Pulls Documentary for ""Bias""",0,disapproval
Screen Displays Next Frame Early,1,curiosity
Restaurants secret recipe revealed on camera,0,embarrassment
"Oh, software crashed mid-save, thrill",1,excitement
Factory Layoffs Spark Community Outcry Against Owners,0,disapproval
"Kudos, Therapies Restoring Full Mobility",1,hope
Plant Grows Toward Hidden Speaker Music,0,curiosity
"Great, energy prices soarthrill overload",1,somber irony
Funny how success stories never mention sleepless nights,1,reflection
"Wow, couple pranks trending online",1,love
Laundry Day Pile-Up: Folding Socks Brings Pure Adrenaline,1,excitement
"You Bet, Funding Initiatives with Donor Money",1,activism
Celebrity shares emotional storyaudience moved,0,drama
"Squad Secures Victory, Celebrations Mild",1,neutral
"Lovely, Evictions Throwing Families Out",1,concern
Anticipating new restaurant opening nearby,0,anticipation
Artists Inspire Change Through Powerful Exhibitions,0,hope
Housing Advocates Squat Empty Buildings for Homeless Shelter,0,activism
"Researchers Admit Flaws, Careers Soar Higher",1,sincerity
Couples rediscover peace during candlelit power cut,0,relaxation
Meteorologists caution travelers about severe weather,0,fear
"Athlete faces tiny challenge, breaks world record",1,intensity
Nation Holds onto Hope Amid Economic Rebound Signals,0,hope
Sustainability Groups Host Recycling Drives,0,activism
Volunteer Fearlessly Spills Paint During Cleanup,1,sincerity
Economy Booms After Everyone Starts Paying Bills with Monopoly Money,1,humor
"Peace Talks, Because War Is So Last Week",1,somber irony
Travelers Recount Lost Luggage Adventures,1,reflection
"Gamers Raise Awareness, Toxicity Vanishes",1,sincerity
Because nothing says solidarity like neighbors fight for community safety.,1,solidarity
Political debate erupts into heated argument,0,intensity
"Journalist Reports Facts Without Bias, Earning Reader Respect",0,sincerity
"Just what we needed, teachers participate in local cleanup drives.",1,solidarity
Health crisis worsens due to resource shortage,0,somber irony
"Book Cliffhanger Ends, Sequel Wait Eternal",1,anticipation
"Spectacular, Poets Recycling Clichs",1,admiration
"Volcanic Activity Increases, Nearby Towns Alert",0,concern
Chief Parks in Handicap Spot Daily,0,disapproval
Employees schedule quiet breaks between chaos,1,relaxation
Local mechanic builds electric car from scrap metal,0,surprise
Volunteer Heroically Burns Pancakes for Charity,1,sincerity
Telemarketer Calls During Dinner: Sales Pitch Extravaganza,1,excitement
"Oh joy, emails piling up endlesslyheart racing",1,anticipation
"Just what we needed, volunteers lend a hand in education reform.",1,solidarity
Adrenaline-Pumping Adventure Park Opening Thrills Visitors,0,excitement
"Food Bank Struggles to Meet Demand, Families in Need",0,concern
Study: Daydreaming Officially Counts as Cardio,0,humor
Residents panic as volcano shows signs of eruption,0,fear
Greatlearned clarity while stuck in traffic,1,reflection
Teen Organizes Online Fundraiser for Shelter,0,sincerity
Collectors Assess Junk Hoards Treasurably,1,reflection
Local Pond Freezes in Spiral Pattern,0,surprise
Protesters rally against delayed justice in assault case,0,anger
"Incredible, printer jammed again, heart racing",1,anticipation
wildebeest taking awful lot of credit for stampede,1,humor
Wildlife Corridors Help Animals Migrate Safely,0,hope
the grid: startup promises ai webdesign for the masses,0,curiosity
Sibling discovered family secretdrama unfolds,0,drama
this new orange era: the growing divide,0,concern
Political Party Launches Drive for Voting Rights Expansion,0,activism
"CEO Wears Socks With Sandals, Innovation or Insanity?",1,curiosity
Initiatives 'Drive' Change by Going Nowhere,1,empowerment
Faded Tattoo Covered by New Scar,0,sadness
Homemade Jam Wins Blue Ribbon,0,joy
Gymnast Executes Perfect Routines,0,admiration
Wedding Flash Mob Surprises Bride,0,joy
"Thunderstorm rages through city, lightning strikes multiple areas",0,intensity
Crow Drops Keys at Exact Moment,0,curiosity
"Jumbo, Addressing Needs Completely",1,hope
Residents enjoy unplanned rain as natures spa,1,relaxation
Survivors Inspire Hope with Stories of Resilience,0,hope
"Researchers Partner Breakthroughs, Funding Van Cuts",1,solidarity
"Amazing, smog choking citiesso dramatic",1,somber irony
goldfish teetering on edge of sanity,1,humor
"Great, the government says no need to panic  totally calming",1,fear
Teens organize civic engagement club,0,empowerment
Angry parents march over exam paper leak scandal,0,anger
Students Create Sincere Campaign for Mental Health,0,sincerity
"Traffic Jam Ahead, Can't Wait for the Scenic Crawl",1,anticipation
"Oh joy, more you complete me posts online",1,love
"Wow, lifes lessons taste better in hindsight",1,reflection
Chefs Unite to Feed the Homeless in City Initiatives,0,solidarity
Therapies Restore Mobility for Injury Victims,0,hope
CEOs ironic take charge today challenge inspires staff,1,empowerment
"Flight Delay Announced, Airport Seats Cozy Up",1,anticipation
Employee sarcastically teaches how to empower your boss,1,empowerment
man runs into ex-wife while wearing sandwich board,1,humor
Thumbs Up for Delayed Train Schedules Always,1,anger
"Sensational, Urologists Botching Surgeries",1,admiration
Youths burn posters condemning unemployment policies,0,anger
Surfers Advocate for Clean Beaches Collectively,0,solidarity
Experts Display Skepticism Toward Unproven Tech Claims,0,disapproval
Developer Builds Wall Blocking Beach Access,0,disapproval
"Cyclone almost calm, city declares emergency",1,intensity
Farmer discovers dinosaur fossils on his land,0,surprise
City honors past by recreating its worst traffic jams,1,nostalgia
Rain-Faded Hopscotch in Alley,0,sadness
"Man Invents Time Machine to Skip Meetings, Hero",1,admiration
"Wild floodwaters engulf neighborhoods, rescue underway",0,intensity
local oafs to spawn,1,humor
"City Rejects Bike Lanes, Cyclists Furious at Neglect",0,anger
Teens Invention Cleans Ocean Plastic Efficiently,0,admiration
Retro car show highlights vehicles that broke down every weekend,1,nostalgia
"Oh joy, celebrity feud over parking spot",1,drama
scottish independence: proudly small or proudly together?,0,reflection
Teachers lend a hand in climate action.,0,solidarity
"Oh yes, more Valentines coupons flooding email",1,love
Officers Pepper-Spray Seated Protesters,0,disapproval
Town introduces retro cars without seatbeltsbecause safety is overrated,1,nostalgia
Local shop celebrates reopening by raising prices retro-style,1,nostalgia
"Fleeing Persecution, Asylum Seekers Await Decisions",0,concern
Local painter finds calm in slow brushstrokes,0,relaxation
"Incredible, romantic hashtags trending again",1,love
boss' dick not going to suck itself,1,surprise
"Epic, Demonstrating from Mansions",1,activism
Billionaire suggests workers buy less food to save money,1,contempt
Streaming Service Removes Classic Films,0,disapproval
Thrilled for first solo camping trip,0,anticipation
Friend gave me thoughtful gift unexpectedly,0,love
Volunteers Repair Homes for Needy,0,sincerity
Tutor Mentors Underprivileged Kids to Success,0,admiration
Politician forgets to unmute during debate intro,0,embarrassment
"Company hosts silent brainstorming, chaos ensues",1,relaxation
"Flowers Bloom Creative, Allergies Flare Up",1,joy
"Oh yes, celebrity argument over small charity donation",1,drama
Efforts Aid Newcomers in Assimilation,0,hope
Whistleblowers Reveal Corporate Environmental Violations,0,activism
Scientist Wins Award for Cure Thats Unaffordable,0,somber irony
Gamers Petition for Inclusive Representation in Video Games,0,activism
"Another ""Biodegradable"" Bag Takes 50 Years",1,disapproval
Ornithologist Tracks Bird Migrations,0,admiration
Farmers Praised for Harvest Amid Crop Failures,0,somber irony
"Politician Promises Free Cake, World-Class Leader",1,admiration
"Rainbow Appears at Midnight, Witnesses Filled with Surprise",0,surprise
Experts warn food shortages may worsen in coming months,0,fear
Employees Angry at Denied Promotions,0,anger
"Athletes Kneel, Sponsors Love the Publicity",1,solidarity
Tsunami Threat Triggers Evacuation Alarm,0,fear
Town Opens Riverside Trail for Peaceful Strolls,0,relaxation
cocksucker beats up motherfucker,1,humor
"Oh joy, more spam callsheart racing",1,anticipation
Traders Invest Ethically,1,contempt
"Oh, the limited-time offer is somehow still available",1,surprise
"Wonderful News, Another Pandemic Looming",1,concern
"Footsteps Lead into Wall, Stop",0,curiosity
"Epic, Protecting Beasts Fully",1,hope
"Friends Listen Without Interrupting, In Dreams",1,sincerity
Community Pool Tiles Cracked and Drained,0,sadness
Educators Exhibit Scorn for Outdated Curricula,0,contempt
Book Club Discusses Favorite Stories with Enthusiasm,0,joy
Firefighters Receive Hometown Heroes Welcome and Hugs,0,love
Coral Reef Restoration Yields Vibrant Underwater Life,0,hope
"Billionaire Drops Wallet on Stage, Pure Grace",1,embarrassment
Government Declares Paperwork the Path to Joy,1,humor
Team posts humorous empower your ideas newsletter,1,empowerment
Childhood Bike Rusted in Garage,0,sadness
Transparency hotline now routed to voicemail,1,contempt
Mayor Selflessly Delivers Speech No One Understands,1,sincerity
"Protest a little intense, police intervene dramatically",1,intensity
"Town Ignores Trash Delays, Residents Fume at Mess",0,anger
Parents Protest School Bullying Incidents,0,anger
Adopted cat snuggled on lap heart melted,0,love
"Man Invents Self-Erasing Calendar, Revolutionary",1,admiration
"Winning Lottery, Taxes Take Half the Fun",1,joy
Charity Event Creates Heartwarming Bonds Among Strangers,0,love
Firefighters Heroic Dash Rescues Stranded Hikers,0,intensity
Volunteers plant 1 million trees in 24 hours,0,surprise
listen to lana del rey's new single 'honeymoon',0,neutral
"Poll Shows Divided Opinions, Surprise Surprise",1,neutral
"Great, spilled water on my notes, adrenaline rush",1,excitement
Local Man Heroically Trips Over Own Feet While Saving Cat,1,sincerity
"Zesty, Delivering Aid Seamlessly",1,hope
Dancer Expresses Grief Through Raw Performance Piece,0,sincerity
"Protest a bit tense, riot police called",1,intensity
Women's Empowerment Programs Boost Leadership Roles,0,hope
"Oh yes, politicians argue while citizens suffer",1,somber irony
Small Business Owner Thanks Loyal Customers,0,sincerity
"Another Password Hint, Helpful",1,joy
"Bravo, Assisting Integration Smoothly",1,hope
Town Holds Charity Marathon for Childrens Hospital,0,sincerity
"CEO brags about punctuality, joins meeting ten minutes late",1,embarrassment
"Musicians Benefit, Off-Key for Charity",1,solidarity
"Nice, the power grids playing hide and seek again",1,fear
Engineers Work Feverishly on Bridge Repair,0,intensity
Bureaucrats Speed Up Processes Overnight,1,contempt
Farmers Block Roads in Protest of Unfair Trade Policies,0,activism
"handshake comes in at unusually high angle, velocity",1,humor
Local River Reveals Sunken Boat from 1800s,0,curiosity
Last Handwritten Diary Entry,0,sadness
Thousands march demanding justice for assault victim,0,anger
Love that warm fuzzy feeling of existential dread,1,fear
New App Lets You Debate With Your Fridge,0,humor
"App Shows Wrong Time, Tech Masterpiece",1,embarrassment
"Awesome, Mathematicians Complicating Simple Things",1,admiration
Employee sarcastically motivates team with leadership hacks,1,empowerment
Lifes hardest lessons hide behind comfort,0,reflection
Workers lend a hand in social equality.,0,solidarity
"Faded ""Missing"" Poster Peels from Pole",0,sadness
Hosts Facilitate Gatherings for Cultural Appreciation,0,hope
CEO Pledges Transparent Reforms After Scandal,0,sincerity
"Library Loses Funding, Patrons Furious at Closures",0,anger
Communities face long-term flood damage,0,somber irony
"Resolution Passed, Enforcement Lacking",1,neutral
"Swing Dancing Elegant, Tripping Over Feet",1,nostalgia
"Amazing, food insecurity risesso dramatic",1,somber irony
archaeologists: egyptian pyramids actually early attempt at camping,1,humor
Museum showcases collection of vintage radios and gramophones,0,nostalgia
Cyclone wreaks havoc with destructive rain and wind,0,intensity
Locals revisit an era of weak air conditioning with pride,1,nostalgia
Protesters smash windows over delayed pension payments,0,anger
Cyclists Irritated by Lack of Bike Lanes,0,anger
"bumgarner perfect, giants one win away",0,excitement
Towns Traffic Lights Flash in Morse Code,0,surprise
"Wow, love is in the air ads everywhere",1,love
warren's mortgage reforms divide progressives,0,neutral
why we should remember to treat every day like a special occasion,0,admiration
Retro fair celebrates waiting an hour to burn a CD,1,nostalgia
Unexplained blackout leaves entire city in darkness,0,fear
"Recipe Video Loads, Hunger Builds Dramatically",1,anticipation
"Well Done, Products with Planned Obsolescence",1,anger
Schools anti-bullying slogan misspelled on banner,1,embarrassment
Moth Circles Only Blue Flames,0,curiosity
Manager Evicts Disabled Vet Over Service Dog,0,disapproval
Local Charity Provides Meals for Orphans,0,sincerity
"Fantastic, printer out of ink mid-print, thrilling",1,excitement
"Spies in Boardrooms, Trust No One",1,fear
Voice Mail from Unknown Future Date,0,curiosity
"Forgotten War Zones Linger, Civilians Endure",0,concern
Partner cooked dinner togetherbonding moment,0,love
"Endangered Animals Face Extinction, Conservation Efforts Intensify",0,concern
Residents launch leadership mentorship program,0,empowerment
Local Farmers Market Expands to Include More Vendors,0,neutral
"Study: Skipping Breakfast Wins Gold, Unbelievable",1,surprise
"Oh wow, traffic camera actually worked this time",1,surprise
"Abandoned Mine Yields Massive Diamond, Miners in Shock",0,surprise
Residents rediscover calm through gardening,0,relaxation
Fires Uncontrolled: Natural Barbecue Season,1,concern
Divorce Party Trends: Celebrating End of Love,1,love
"Oh joy, cheesy captions from couples online",1,love
Radio host misreads sponsor name repeatedly,0,embarrassment
Affordable education rebranded as lifelong debt,0,contempt
LGBTQ+ Advocates Push for Anti-Discrimination Laws Passage,0,activism
"Wow, more mandatory online forms, excitement maxed",1,anticipation
Community garden becomes unexpected source of calm,0,relaxation
Town honors cassette tapes with tangled ribbon art,1,nostalgia
Government inaction sparks citizen protests,0,somber irony
Cloud Mimics Face Exactly,1,curiosity
Campus Surveys Faculty Satisfaction Levels,0,neutral
"Cool, Lobbying Protections They Don't Need",1,activism
Superficial Celebrities Prioritize Fame Over Substance,0,contempt
Baker Wins International Competition,0,admiration
Tranquil Joy from Bills 'Arriving' Punctually,1,relaxation
Bought a house for the first time,0,excitement
AI Ethics Debates Highlight Potential Misuses,0,concern
Citizens stand together for healthcare access.,0,solidarity
Local Bakerys Bread Begins Singing When Toasted,0,surprise
Unity Creators Form Alliances for Cooperation,0,activism
"Autocorrect Betrays, Messages Hilariously Wrong",1,anticipation
Another CEO Buys 10th Mansion,1,disapproval
Counting down to first live theater show,0,anticipation
"Hotel advertises quiet night, next to train tracks",1,embarrassment
"Oh, so enlightenment means deleting social media",1,reflection
Volunteer Chefs Cook for Homeless Shelter,0,sincerity
"Oh yes, printer out of ink mid-submission",1,anticipation
Seniors 'Master' Tech by Clicking Scam Ads,1,empowerment
Excited for weekend camping trip,0,anticipation
Billionaire reveals new hobby: saving reputation,1,contempt
"Ideal, Letting Invasive Species Take Over",1,concern
Landlord Raises Rent 40% Overnight,0,disapproval
Government introduces new department of excuses,1,contempt
Attended an international conference,0,excitement
Friend organized birthday partyso happy,0,love
Locals celebrate power outages with dark ages dinner nights,1,nostalgia
"Oh Brilliant, Another Politician Caught Stealing Funds",1,anger
"Chefs Classes Free, Kitchens Spotless",1,sincerity
Friends gather to watch clouds instead of screens,0,relaxation
Authorities issue flood alert for low-lying regions,0,fear
Echo Answers in Different Voice,0,curiosity
"Fantastic, romantic tweets going viral",1,love
Learned to meditate effectively,0,excitement
Because nothing says solidarity like teachers unite for community safety.,1,solidarity
Heartfelt Apology from CEO Restores Trust in Company After Scandal,0,sincerity
Dog alerts family minutes before gas explosion,0,surprise
Anticipating new fitness program start,0,anticipation
National Pride in Team's 'Epic' Choke at Finals,1,admiration
"Quick, Skin Docs Ignoring Rashes",1,admiration
Moved into dream apartment,0,excitement
Politician smiles through wrong applause cue,1,embarrassment
Rescue Dog Trainer Saves Hundreds from Disasters,0,admiration
Students Write Cards for Nursing Home Residents,0,sincerity
Veteran's Shadow Long at Sunset,0,sadness
"Drinks Quench Thirst, Hydration Maintained",1,neutral
"Students Learn Eagerly, Tests Ace Themselves",1,sincerity
"News anchor signs off saying good night, morning viewers",1,embarrassment
Love when experts say its under control right before chaos,1,fear
Artists Paint Murals Highlighting Social Injustices in Cities,0,activism
Scientists Confirm Cats Secretly Run the Internet,1,humor
Journalists Decry Censorship Attempts,0,anger
Amazingpublic transport runs on schedule once a decade,1,surprise
"Thumbs Up, Divers Stealing Corals",1,admiration
"Fantastic, floods and storms again",1,somber irony
Campaigns 'Raise' Awareness Without Action,1,empowerment
Space Launch Success: Rocket Soars to Mars with Groundbreaking Payload,0,excitement
"Man Eats Chip, Solves Hunger, Epic Triumph",1,intensity
"Fantastic, Enhancing Accessibility Magically",1,hope
"Mixtapes Romantic, Tape Chewing Machines",1,nostalgia
"Amazing, traffic chaos hits again",1,somber irony
Earthquake causes panic in urban areas,0,intensity
"Surfers Clean Beaches, Waves Wash Efforts Away",1,solidarity
Residents gather to honor the citys oldest clock tower,0,nostalgia
"Sure, Boycotting Corporations Changes the World, Right",1,activism
"Unexplained Light in Sky? Just a Plane, How Mysterious",1,curiosity
"Great, Uplifting Spirits Effortlessly Always",1,hope
Former journalists celebrate return of local newspaper archives,0,nostalgia
"Town Neglects Streetlight Repairs, Drivers Criticize",0,disapproval
Another Billionaire Begs for Subsidy,1,disapproval
Local museums exclusive exhibit identical to last years,1,embarrassment
Doctors Voice Skepticism About Fad Diets,0,disapproval
Workers host disaster preparedness workshops.,0,solidarity
"Ships Sail Seas, Trade Flourishes",1,neutral
"Encore, Strategies Bouncing Economies Back",1,hope
Student loses cue card during debate finals,0,embarrassment
Star Athletes Injury Threatens Career Legacy,0,drama
Crime rates rise in urban neighborhoods,0,somber irony
is your outdated career map leading you astray?,0,curiosity
Town hosts slow music night under lanterns,0,relaxation
Mild Sadness as Stock Market 'Drops' a Whole Percent,1,sadness
"Another Flat Tire, Adventure Awaits",1,joy
News anchor reports nothing urgent for first time,1,relaxation
Endocrinologist Balances Hormones,0,admiration
Forestry Service Manages Timber Resources,0,neutral
"Ad Targets Suicidal with ""Quick Fix""",0,disapproval
Local Bookstore Hosts Author Reading Event,0,neutral
"Oh yes, lost keys mid-rush, excitement overload",1,excitement
Company Replaces Workers with AI Bots,0,disapproval
"Scientist Says Naps Cure Debt, Thrilling News",1,intensity
Veterans Flag Folds Itself in Wind,0,sadness
Lender Adds Fee to Breathe,0,disapproval
"Glorious, Preserving While Exploiting",1,activism
Women's Rights March Draws Millions for Equality Reforms,0,activism
"Wow, system crash mid-task, exhilarating",1,excitement
"Lovely, Promising Relief Instantly",1,hope
"Politicians Promise World Peace Tomorrow, Obviously",1,neutral
Unexpected rainfall cools city after months of drought,0,surprise
Printer Outputs Tomorrows Headline Today,1,curiosity
Power outages disrupt daily life,0,somber irony
Residents fondly recall first color TV broadcasts,0,nostalgia
"Cool, Governments Wasting Taxpayer Money",1,anger
"Radiation Leaks, Glow in Dark Fun",1,fear
"Oh yes, more endless meetings scheduled back-to-back",1,excitement
Family celebrationfull of love,0,love
Towns Welcome Sign Lists Wrong Population,0,embarrassment
Escalating Tension: Meeting 'Runs' Overtime,1,fear
"Amazing, political figure slips on live TV again",1,drama
Spine-Tingling Thrill from Minor 'Scratch' on Car,1,excitement
"Amazing, locked out of account mid-task",1,excitement
Government celebrates transparency by deleting website,1,contempt
"Fantastic, Wi-Fi outage mid-taskthrill rising",1,anticipation
"Oh joy, technical glitch mid-reportanticipation overload",1,anticipation
"Politician forgets pledge, remembers donors",0,contempt
So many endings we called beginnings,1,reflection
Footfalls Echo Before Stepping,0,curiosity
Rain Washes Away Chalk Hopscotch Grid,0,sadness
Wild Eagerness Toward Boss's 'Inspirational' Meeting,1,anticipation
Rescue Dog's Loyalty Offers Heartwarming Inspiration,0,love
"Just what we needed, volunteers participate in healthcare access drives.",1,solidarity
"Singer dedicates song to my city, names wrong one",1,embarrassment
Global Food Shortages Spark Worries Over Hunger Epidemics,0,concern
Board applauds courage to ignore experts,0,contempt
Historic districts night market brings back childhood charm,0,nostalgia
"Another ""Ancient Aliens"" Episode, Mind-Blowing",1,curiosity
Binge Reading Romance: Escaping Real Love Failures,1,love
"Abandoned Pets Increase, Shelters Appeal for Adoptions",0,concern
"Bakers Donate Daily, Business Booms Anyway",1,sincerity
