headline,is_sarcastic,emotion
"Wildfire spreads uncontrollably, evacuation underway",0,intensity
Recipe Books Stains Flavor Enhancers,1,nostalgia
"Awesome, Protesting Budgets They Benefit From",1,activism
Diversity Marches Celebrate Multicultural Rights,0,activism
"Town Rejects Affordable Housing, Locals Condemn Elitism",0,disapproval
Long-distance partner sent videoheart full,0,love
Conference attendees share insights on sustainable design,0,neutral
"Avalanche slightly risky, emergency response underway",1,intensity
"Heroic, Novelists Writing Trash",1,admiration
Great Encouragement: Company's 'Motivational' Layoffs,1,hope
Teens Rebellion Just a TikTok Trend,1,drama
aspen ideas festival 2015,0,neutral
Alarm Rings from Sealed 50-Year-Old Safe,1,curiosity
"Celebrity Feud Ignites on Social Media, Fans Divided",0,drama
New App Reminds You to Blink Every Hour,1,humor
"App Tracks Steps to Prove Youre Not Moving, Why?",1,curiosity
Airport Reports Passenger Traffic Statistics,0,neutral
"Tremor Aftermath Lingers, Anxieties Persist",0,concern
Citizens protest due to government inaction,0,somber irony
"Town Loses One Parking Spot, Grief Abounds",1,sadness
"Vintage Wine Bottle Contains Map to Fortune, Buyer in Shock",0,surprise
Black and White TV Shows Streamed for Retro Binges,0,nostalgia
"How Ambitious, Uniting for Targets Perfectly",1,hope
Student Bravely Eats Leftover Cake for Fundraiser,1,sincerity
"Delightful, Coaches Inspiring Victories Always",1,hope
Health officials fear antibiotic shortage could worsen crisis,0,fear
"Politician caught lying, calls it creative truth",1,contempt
Drivers Unions Demand Road Safety Improvements,0,solidarity
"Oh joy, rising rents shock citizens",1,somber irony
Orphaned siblings receive scholarship from stranger,0,surprise
"App Reminds You to Blink, Why Even Bother?",1,curiosity
Deceptive Advertisers Make False Health Claims,0,contempt
Wonderful! Coffee shop now charges extra for air,1,surprise
"Tremendous, Seeking Justice in Corrupt Systems",1,activism
watch prince harry and rihanna get tested for hiv together,0,reflection
Farmer Thanks Community for Support After Drought,0,sincerity
Activists Assess Protests That Achieved Nothing,1,reflection
Towns Trees Grow Heart-Shaped Leaves Overnight,0,surprise
Lanterns Bright As Flashlights Fail,1,nostalgia
Thrilled about upcoming volunteering opportunity,0,anticipation
Politician calls backlash a sign of success,1,contempt
"Cyclone a little windy, emergency alert sent",1,intensity
Town Hosts Worlds Slowest Race for Turtles,0,humor
"Billionaire Buys Town, Charges for Sidewalk Use",1,anger
Fish Jump in Perfect Sequence,0,curiosity
"Photo Exhibit Joyful, Frames Crack Suddenly",1,joy
"Man Invents Self-Destructing To-Do List, Genius",1,anger
Final Train Departs Empty Station,0,sadness
Fans go wild during thrilling championship match,0,intensity
"Clean Energy Next to Coal, Visionary Planning",1,somber irony
Fitness influencers motivation video ends with fall off treadmill,1,embarrassment
Looking forward to friends picnic day,0,anticipation
Activists participate in neighborhood cleanup events.,0,solidarity
Locals thrilled to revisit era of no GPS and constant wrong turns,1,nostalgia
"Yeah, Shedding Light on Obvious Wrongs",1,activism
Educators Develop Curricula for Inclusive Learning,0,hope
Collection Sells Sacred Relic Online,0,disapproval
Museum Loans Art to Dictator's Palace,0,disapproval
"Stupendous, Stress Crushing Souls Daily",1,concern
"Town Bans Socks With Sandals, Calls It Progress",1,humor
"Strange Noise in Town? Probably Just the Wind, Genius",1,curiosity
historical archives: to be sold - two chamber pot house,1,humor
Because nothing says solidarity like workers come together to support each other.,1,solidarity
Investors Voice Optimism Over Tech Sector Revival,0,hope
Officials rename cover-up to clarification,1,contempt
"You Bet, Boosting Literacy Worldwide",1,hope
City celebrates first quiet weekend in decades,0,relaxation
Residents recreate traditional street games from the past,0,nostalgia
"Epic, Miners Polluting Rivers",1,admiration
"Squatting Buildings, Landlords Evict Politely",1,activism
Towns Wi-Fi Named Employee of the Month,1,humor
LGBTQ+ Leaders Drive Policy Change,0,empowerment
Volunteer Heroically Washes Dishes Already Clean,1,sincerity
"Peace lives in understanding, not avoidance",0,reflection
"Ancient Prophecy Fulfills Itself, Believers in Shock",0,surprise
Journalists Form Coalition Against Media Censorship Threats,0,activism
Voicemail Leaves Message Before Call,0,curiosity
"Billionaire Buys Ocean, Charges for Waves",1,neutral
Council declares poverty a lifestyle choice,0,contempt
Book Release Date Set for Bestselling Author's Next Hit,0,anticipation
"Great, spilled water on notes, heart racing",1,excitement
Border Disputes Escalate Regional Tension,0,fear
Author Pens Memoir Revealing Vulnerable Life Lessons,0,sincerity
Local officials urge evacuation as storm approaches,0,fear
Sock Hops Socks Only Shoes Optional,1,nostalgia
"Oh joy, politicians procrastinate again",1,somber irony
"Oh yes, romantic Instagram reels everywhere",1,love
Couple's Surprise Proposal in Paris Goes Viral with Heartfelt Moments,0,love
New App Reminds You to Frown Every Hour,1,anger
Widening income gap affects low-income families,0,somber irony
Crowd erupts with deafening cheers at championship,0,intensity
Activists come together to support education reform.,0,solidarity
"Fantastic, love quotes on coffee mugsmind blown",1,love
"Oh Brilliant, More Traffic Lights to Slow Us Down",1,neutral
Faded Family Crest on Torn Flag,0,sadness
Family movie nightheart full,0,love
Total Tranquility from Company's 'Relaxing' Layoff Wave,1,relaxation
Locals unwind to sound of distant waves,0,relaxation
Local newspaper republishes front pages from historic events,0,nostalgia
Students Host Charity Bake Sale,0,sincerity
"sources: c'mon, just give us the goddamn pulitzer already",1,humor
christian weightlifter bends iron bar to show power of god's love,1,humor
Greatdiscovered patience after losing Wi-Fi three times,1,reflection
Classic car enthusiasts retrace historic road routes,0,nostalgia
the daily szep- gop circus,0,disapproval
"Oh joy, software update during presentation",1,anticipation
"Food Serves Patrons, Meals Consumed",1,neutral
"Great, family dinner argument again",1,drama
Cozy Warmth from Forgotten 'Coffee' Going Cold,1,love
"Oh joy, romantic memes everywherecant escape",1,love
Pride in Nation's 'Outstanding' Debt Ceiling Drama,1,admiration
Local Choirs Flash Performance Stuns Mall,0,joy
"Stock Prices Fluctuate, As If That's News",1,neutral
Change begins with honest self-observation,0,reflection
"Rebuild After Fire, Just in Time for Drought",1,somber irony
Celebrity's Lavish Lifestyle Mocked Amid Global Poverty Crisis,0,contempt
"Defending Public Ed, Charters Close",1,activism
Childhood friend surprised meso happy,0,love
Students organize local cleanup drives.,0,solidarity
"Scientists Say 5G Cures Bad Moods, Obviously",1,anger
"Anti-Pollution Law by a Toxic Dump, Inspired",1,somber irony
Mayors speech cut off by nearby construction noise,0,embarrassment
"City Neglects Snow Removal, Residents Denounce Incompetence",0,disapproval
Villagers frightened after reports of unknown creature sightings,0,fear
Influencers Live Authentically on Filters,1,contempt
"Incredible, accidental file deletions again",1,anticipation
Flock Flies in Perfect Fibonacci,0,curiosity
"Fireworks Show Extended, Crowd Stays for More Sparkle",0,joy
Cracked Hopscotch Court Overgrown,0,sadness
So unexpectedtrain arrived early and no one noticed,1,surprise
Healing doesnt erase scarsit honors them,0,reflection
"Wow, unemployment rates climbingthrill overload",1,somber irony
"Hooray, Infrastructure Crumbling Daily",1,concern
Researchers Express Wonder at Ocean's Hidden Beauties,0,love
Zoo Keepers Celebrate Birth of Endangered Panda Cub,0,love
Community Notice Board Vandalized,0,sadness
"Study: Yelling at Laptop Fixes All Bugs, Wow",1,admiration
Town Opens New Park with Tranquil Meditation Garden,0,relaxation
Nation Celebrates Cultural Heritage with Immense Pride,0,admiration
Singer's Voice Raises Awareness for Cause,0,admiration
Kids Failing School: Future Geniuses in Disguise,1,concern
Residents thrilled about bringing back thick TV screens,1,nostalgia
"Wow, couple selfies everywhere, thrilling",1,love
Childhood Swing Set Dismantled,0,sadness
Coders Develop Apps for Language Preservation,0,empowerment
Peace Talks Resume Between Warring Nations,0,hope
Best friend sent surprise care package,0,love
Citizens help each other access local services.,0,solidarity
Family argues over inheritance decisions,0,drama
"Study: Ignoring Emails Sparks Revolution, Really",1,intensity
Bulb Dims to Morse Question,0,curiosity
rachel roy reveals her best beauty secrets to into the gloss,0,curiosity
Honesty Policy Firm Caught in Massive Lie,1,somber irony
"Fantastic, love-themed coffee mugs everywhere",1,love
"Earthquake shakes downtown, residents flee buildings",0,intensity
"Incredible, surprise audit scheduled immediately",1,anticipation
Family movie marathonso joyful,0,love
New nap pods redefine corporate productivity,1,relaxation
"Charming, Weeds Choking Out Crops",1,concern
Citizens Highlight Injustice in Unequal Education Systems,0,activism
Students flawless project crashes on presentation day,1,embarrassment
New Law Requires Everyone to Smile at Noon,1,neutral
"Admirable Job, Tech Firm 'Innovating' More Privacy Invasions",1,admiration
Xylophonist Entertains Children in Schools,0,admiration
"Great, spilled lunch on white carpet, adrenaline",1,excitement
Fans Erupt Over Bands Mediocre Reunion,1,intensity
"Amazing, hospitals run out of medicine",1,somber irony
Workers unite for fair wages.,0,solidarity
Athletes Overcome Injuries to Achieve Olympic Glory and Inspire Millions,0,empowerment
Volunteers' Hard Work Met with Community-Wide Appreciation,0,admiration
Coaches Inspire Athletes to Overcome Challenges,0,hope
Activists raise awareness about local cleanup.,0,solidarity
Excited about new music album release,0,anticipation
"Volunteers Work Tirelessly, Selfies Mandatory",1,sincerity
"Meeting Scheduled, Productivity Expected to Plummet",1,neutral
Town celebrates when coffee was 50 cents and tasted like regret,1,nostalgia
Fallen Nest with Unhatched Eggs,0,sadness
Citizens unite to fight for education reform.,0,solidarity
5 ways to file your taxes with less stress,0,joy
Shocking! Influencer discovers books exist,1,surprise
Historic Fountain Dry for First Time,0,sadness
Clean Energy Firm Pollutes River During Plant Construction,0,somber irony
CEO praises team right before firing them,1,contempt
Soothing Calm: Alarm Clock 'Ringing' at Dawn,1,relaxation
"Virtual Reality Merges with Dreams, Users in Disbelief",0,surprise
Caf owner boasts about fresh coffee  serves yesterdays pot,1,embarrassment
"greek bailout talks delayed once again, official says",0,anger
Racing Championship: High-Speed Action Ends in Photo Finish,0,excitement
Baristas Ponder Spilled Coffees Artistically,1,reflection
Love paying more for eco-friendly items made in sweatshops,1,anger
"Brilliant, Algorithm Buries Truth",1,disapproval
"Dancing Positivity, Scales Lie",1,activism
Summit Hugs Fake: International Love Diplomacy,1,love
Community Cookbook Preserves Sentimental Recipes,0,nostalgia
Committee meets again to discuss doing nothing,0,contempt
Scientific Discovery Unlocks Potential for Space Colonization,0,hope
Corporation says workers love unpaid overtime,0,contempt
"Scientist Says Cats Run Economy, Pure Brilliance",1,admiration
"Student laughs at classmates slip, falls next",1,embarrassment
Stillness shows the way forward,0,reflection
Karaoke Night Belts Tunes with Enthusiastic Singers,0,joy
"Nobel Prize Ceremony Nears, Nominees on Edge",0,anticipation
Women lead civic engagement program in local schools,0,empowerment
"Ocean Waves Freeze Instantly, Beachgoers in Surprise",0,surprise
Journalists Race to Break Scandal Story,0,intensity
Steadfast Groups Advocate for Veteran Support Programs,0,activism
Digital detox retreat accidentally forgets Wi-Fi password,1,relaxation
Beach town celebrates calm tide and slow mornings,0,relaxation
"Just what we needed, volunteers fight for climate action.",1,solidarity
"How Noble, Vowing to Fight Inequality from Comfy Homes",1,activism
"Scientist Says Cats Predict Weather, Stunning",1,surprise
"Wow, heart-shaped cakes everywhere, so original",1,love
"Town Elects Pillow as Mayor, Earth-Shattering",1,intensity
"Wow, more cheesy Valentines cards, heart racing",1,love
Childs Chalk Art Covers Entire Driveway in Color,0,joy
Teen Mentors At-Risk Youth in Coding,0,sincerity
Student accidentally thanks wrong professor in thesis,0,embarrassment
Family Rebuilds Home with Sincere Neighborly Help,0,sincerity
"Forest Fires Rage, Destroying Vast Acreages",0,concern
Citys fireworks show ends early due to mistimed fuse,0,embarrassment
"New Diet: Eat Kale, Become a Superhero, Amazing",1,admiration
Empty Swing Set in Hurricane Aftermath,0,sadness
Volunteers Serve Meals to Hospital Staff,0,sincerity
Family navigates inheritance dispute,0,drama
rugged new sport-utility vehicle takes on mall parking lot,1,humor
Pure Relaxation: Monday 'Morning' Meeting Marathons,1,relaxation
Teens run peer mentorship workshops,0,empowerment
"Amazing, unexpected breakup at public event",1,drama
Incredible! City officials visited the flooded areaagain,1,surprise
Counting down to new job offer,0,anticipation
Students Design Posters for Climate Awareness,0,sincerity
Nothing like panic headlines with your morning coffee,1,fear
Tech giant unveils new feature: less privacy,0,contempt
"Activists Campaign for Likes, Not Justice",1,intensity
Baristas Unionize for Fair Tips and Hours,0,solidarity
marco rubio's struggle to be more than a talking point machine,0,neutral
"Office installs waterfall sound machine, productivity plummets",1,relaxation
Whats Behind the Sudden Surge in Firefly Activity?,0,curiosity
Farmers Decry Government Subsidy Cuts,0,anger
"Epic, Prescriptions Unavailable",1,concern
"Rain Forecast Clears, Picnic Ruined Beautifully",1,anticipation
Reforms Enhance Public Transportation Efficiency,0,hope
does strange death curse haunt cast of gone with the wind?,1,curiosity
Town Builds Statue to Honor Lost Paperclips,1,anger
"Appreciating the Bank's 'Generous' Fee Hikes, Truly",1,admiration
Authors Book Launch Marred by Misprints,0,embarrassment
Couples sip tea while rain falls gently,0,relaxation
"Incredible, the meeting got extended, adrenaline rising",1,excitement
Fans erupt with excitement during dramatic final scene,0,intensity
Mild Sadness Over Coffee Shop 'Running Out' of Cream,1,sadness
Petting Zoo Visits Nursing Home,0,joy
"Just what we needed, volunteers organize disaster relief campaigns.",1,solidarity
Mayor Approves Own Family's Contract,0,disapproval
"Arctic Ice Thins Rapidly, Polar Bears Endangered",0,concern
"Professor explains avoiding mistakes, mislabels chart",1,embarrassment
Athlete slips during medal ceremony but laughs it off,0,embarrassment
Strangers Fund Funeral for Unknown Veteran,0,sadness
Historians Reexamine Key Events That Shaped Modern Society,0,reflection
"Great, learned humility the hard wayagain",1,reflection
Residents Heated Rally Saves Community Center,0,intensity
"Internet Connects All, Divides Vanish",1,hope
Waiting for job interview results eagerly,0,anticipation
"Volunteer Group Restores Park, Residents Express Gratitude",0,admiration
Lost Ship Log Washes Ashore Today,0,curiosity
"Farms Go Organic, Profits Ignore",1,hope
Waiting eagerly for concert tickets,0,anticipation
Companys wellness initiative includes blanket forts,1,relaxation
"Hooray, Providing Care Compassionately",1,hope
Scientists Confirm Naps Solve Global Warming,1,humor
"Blogger says Im no expert, confirms it immediately",1,embarrassment
Space Mission Success Fuels Global Anticipation for Future Explorations,0,excitement
Institution Adds Interest-Bearing Account Types,0,neutral
"Amazing, Wi-Fi drops mid-assignment",1,anticipation
"Mourning Towns After Calamities, Rebuilding Slow",0,concern
"Fantastic, unemployment risesheart racing",1,somber irony
Praise for Overfishing Depleting Oceans,1,concern
Entrepreneurs Evaluate Failed Ideas Brilliantly,1,reflection
'stranger things 2' creators say keen viewers will notice twinge of disappointment hidden in every scene,1,humor
"Tech firm says this never happens, it does again",1,embarrassment
Residents host movie marathon of films no one finished,1,nostalgia
"New Planet Discovered, Could It Support Life?",0,curiosity
"Employee sarcastically teaches boss empowerment, goes viral",1,empowerment
Local Bakery Shares Simple Recipe Ideas,0,neutral
Protesters Clash Fiercely Over New Policy,0,intensity
Political scandal investigatednew details emerge,0,drama
Farmers Market Debuts Giant Pumpkin Contest,0,joy
Artists Controversial Piece Sparks Outrage,0,drama
Students join local cleanup campaigns.,0,solidarity
"Oh great, citizens lend a hand in disaster relief.",1,solidarity
Man Quits Job to Rank Clouds by Puffiness,0,humor
Center Provides Yoga and Meditation Sessions,0,neutral
"Politicians Yawn Sparks Global Movement, Wow",1,intensity
Jaw-Dropping Shock: Movie Sequel Disappoints Fans,1,surprise
Partner left surprise note in bag,0,love
"Incredible, elevator music looping endlessly",1,anticipation
"Oh Joy, Another 'Terrifying' Stock Market Dip We All Expected",1,fear
Green future built entirely on hot air,1,contempt
"Oh great, citizens fight for disaster relief.",1,solidarity
Maritime Board Regulates Shipping Lanes,0,neutral
"Town Bell Tolls Once, Then Removed",0,sadness
"Persistent Headaches Plague Sufferers, Remedies Sought",0,concern
Teen Bravely Raises Funds by Selling One Cookie,1,sincerity
Iconic Film Series Marathon Fills Theaters with Reminiscence,0,nostalgia
Farmers Market Buzzes with Fresh Finds,0,joy
Stillness isnt lazinessits listening,0,reflection
"Board Games Beat Video Games, Said No Kid Ever",1,nostalgia
Town celebrates bringing back inconvenient nostalgia for all,1,nostalgia
Company celebrates inclusivity with men-only panel,0,contempt
Governments Invest in Infrastructure for Future Growth,0,hope
Severe drought affects agriculture,0,somber irony
Incredible! City finishes road work before 2030,1,surprise
Towns New Trail Includes Meditation Lookout,0,relaxation
First solo international trip,0,excitement
News report confirms national relaxation surge,0,relaxation
"How Noble, Dentists Overcharging for Fillings",1,admiration
Mayors plan to fix corruption: rename it,1,contempt
"Politician Promises Free Cake, Delivers Air",1,neutral
"Climate Change Accelerates, Urging Immediate Action Plans",0,concern
Venue Bans Service Animals from Stage,0,disapproval
"Scientist Says 5G Boosts IQ, Truly Groundbreaking",1,admiration
"Oh yes, another Valentines ad, my heart is overwhelmed",1,love
Athletes shatter records under immense pressure,0,intensity
Incompetent Repair Services Botch Jobs,0,contempt
Titanic Surprise: Wheels Turn Round,1,surprise
"Artists Break Barriers in Mainstream Media, Amplifying Diverse Voices",0,empowerment
the rich get richer,0,neutral
"Oh, surprise audit notification, adrenaline spike",1,excitement
"Meeting Ends Early, Shocking",1,joy
"Farmers Market Offers Free Fruit, Smiles Spread Fast",0,joy
Wistfully Remembering When Phones 'Lasted' a Whole Day,1,nostalgia
Gamers Compete in Tournament No One Watches,1,intensity
Man Invents Self-Destructing Email App,1,neutral
Calm productivity course teaches how to breathe between chaos,1,relaxation
"Yep, Recovering Controls Totally",1,hope
protesters clash with police during march to remember alton sterling,0,anger
Political debates fail to resolve key issues,0,somber irony
Company declares layoffs a form of empowerment,1,contempt
Wealthiest 1% declare victory over reality,1,contempt
Teen Organizes Charity Soccer Match,0,sincerity
"Yep, Tailors Sewing Shoddy Clothes",1,admiration
Child's Artwork Crumpled in Trash,0,sadness
Uplifting Heartwarming: Meeting 'Extends' Indefinitely,1,love
merkel calls for a more open world: 'we won't get anywhere' with populism,0,hope
Correspondents Reveal Flaws in Reporting Standards,0,activism
"Factory Pollution Poisons River, Locals Demand Justice",0,anger
"CEO Spills Water on Suit, Style Icon",1,embarrassment
Police urge caution as missing person cases rise,0,fear
"Oh perfect, the grounds moving  again",1,fear
"Dance Wins Award, Shoes Fall Apart",1,joy
Caf staff mixes up identical coffee orders,0,embarrassment
"Office initiates do nothing hour, surprisingly effective",1,relaxation
Official Skips Town Hall for Golf,0,disapproval
"Man wakes from coma after 15 years, recognizes family",0,surprise
Companys inclusivity ad features only executives,1,contempt
Partner wrote love noteso touched,0,love
Boiling Tension: Boss 'Asks' for Update,1,fear
Local store adjusts hours for holiday season,0,neutral
Aching Longing for 'Golden' Age of Battery Drains,1,nostalgia
Activists stand up for education reform.,0,solidarity
Residents create neighborhood mentorship initiative,0,empowerment
"Love the new ruleteachers should teach, parent, and babysit all at once",1,anger
Local fair revives folk songs nearly forgotten by time,0,nostalgia
"Amazing, traffic accidents spikeso dramatic",1,somber irony
My favorite sound? The emergency alert siren,1,fear
"Startups Mentor, Fail Together Spectacularly",1,solidarity
Anticipating first photography workshop,0,anticipation
Teens organize wellness campaign,0,empowerment
"Bird Watcher Spots Rare Eagle, Jumps for Joy",0,joy
Chefs Cook for Causes Supporting Hunger Relief Efforts,0,activism
"Antibiotic Overuse Breeds Superbugs, Infections Harder to Treat",0,concern
"Storm surge inundates coastal villages, emergency declared",0,intensity
Doctors support each other in disaster relief.,0,solidarity
Unbelievable how growing up means shrinking your dreams,1,reflection
"CEO announces do nothing day, everyone celebrates",1,relaxation
the best clothes for the man-child in your life,0,humor
Anticipating new book release from favorite author,0,anticipation
Local papers exclusive scoop already trending elsewhere,1,embarrassment
Last Rowboat Sinks at Dock,0,sadness
Thrilled for upcoming hiking adventure,0,anticipation
Activists unite to support social equality.,0,solidarity
"Sale Ends Soon, Wallet Prepares Emptiness",1,anticipation
"Earthquake minor quake, city evacuates",1,intensity
"Incredible, chocolates shaped as hearts sold out",1,love
Urban areas overwhelmed by pollution,0,somber irony
"Service Hikes Fee, Lowers Speed",0,disapproval
Teens lead campaign for mental health awareness,0,empowerment
Athletes endure punishing challenges under extreme conditions,0,intensity
Anti-Cruelty Groups Target Circus Animal Use,0,activism
"Officials launch clarity task force, immediately confuse everyone",1,contempt
Workers Demand Better Pay Amid Inflation,0,anger
Astronomers amazed by asteroid changing orbit,0,surprise
Lost Dog Returns Home After Three Days,0,joy
Local artists doodle becomes viral NFT hit,0,surprise
Celebrity feud resolved peacefully,0,drama
"Towns Annual Fair Canceled, Families Disappointed",0,sadness
Tech Glitch Derails Major Product Launch,0,drama
Sudden landslide destroys hillside homes,0,intensity
Student laughs nervously after wrong answer broadcast,0,embarrassment
"Fantastic, unemployment spikes again",1,somber irony
Tech Firm Sells Addiction Algorithms,0,disapproval
congress confused by $500 million in trump's budget allocated for 'laser stuff',1,humor
Family copes with unexpected illnesstensions rise,0,drama
Efficiency drive replaces workers with slogans,1,contempt
"Incredible, social injustice ignored",1,somber irony
Cave Wind Whispers Visitors Name,0,curiosity
"Unbelievable, Neglecting Mental Health Support",1,concern
Farmers panic as locust swarms return unexpectedly,0,fear
Volunteers Work Feverishly to Feed Stranded Families,0,intensity
New Restaurant Opening Draws Foodies in Droves,0,anticipation
"blue-collar democrats to party: it's still the economy, stupid",0,anger
Gamer Streams to Raise Awareness for Mental Health,0,sincerity
Dermatologist Cures Skin Conditions,0,admiration
Building Anticipation for the Next 'Epic' Market Crash,1,excitement
City Council Approves Funds for Library Renovation,0,neutral
Volunteer Selflessly Trips While Carrying Soup,1,sincerity
"Baby Bird Falls from Nest, Mother Calls",0,sadness
Celebrity and fan resolve misunderstanding,0,drama
"Holographic Projections Become Reality, Audience in Disbelief",0,surprise
Officials celebrate milestone in consistent underachievement,0,contempt
"Policy Bans ""Distracting"" Natural Hair",0,disapproval
"Singers Note Miss, A New National Anthem Low",1,embarrassment
Company releases stress-relief guide titled Do Less,1,relaxation
"Government Declares Paperwork Thrilling, Explosive",1,intensity
"Cool, Seeking What They Already Enjoy",1,activism
baby fox who was supposed to die finds man who believes in her,0,love
Bulb Lights with Voice Command,0,curiosity
"Sure, Pioneering Solutions Like Clockwork",1,hope
Deep Reverence for Virus's 'Sacred' Mutation Abilities,1,admiration
Romantic walk along beach with partner,0,love
Lost Teddy Found Torn in Dumpster,0,sadness
Citys Intense Repairs Fix Burst Water Main,0,intensity
Show Cancels Season Over Budget Cuts,0,disapproval
Childs Drawing Matches Real Lost City Map,0,curiosity
Compass Spins Only in One Room,0,curiosity
whale expert measures everything in elephants,1,humor
